slug,name,region,lat,lon,distance_km,ascent_m,route_type,time_hours,terrain,difficulty,scramble_grade,os_map,parking,parking_lat,parking_lon,parking_cost,facilities,dog_friendly,waymarked,best_season,hazards,highlights,quality_score,tier,description,tags_audience,tags_features,tags_conditions,best_for
pen-y-fan-storey-arms,Pen y Fan via Storey Arms,brecon-beacons,51.8839,-3.4367,6.5,460,out-and-back,2.5-3.5,mountain-path,moderate,,OL12,,51.8795,-3.4984,free,toilets|food-truck,Yes,yes,year-round,weather|erosion,summit|views|iconic,85,Classic,The 'Motorway' route. Most popular and easiest way to the highest peak in South Wales. Well surfaced path but steep. Very busy on weekends.,families,dog-friendly|linear|toilets|waymarked,clear-weather-only,views
pen-y-fan-pont-ar-daf,Pen y Fan via Pont ar Daf,brecon-beacons,51.8839,-3.4367,6.0,440,out-and-back,2.5-3,mountain-path,moderate,,OL12,,51.8672,-3.4564,free,toilets|food-truck,Yes,yes,year-round,weather|crowds,summit|accessible-start|views,85,Classic,Slightly shorter alternative starting from the main car park. Merges with Storey Arms path. Good wide path suitable for most abilities (but still a mountain).,families,dog-friendly|linear|toilets|waymarked,clear-weather-only,views
pen-y-fan-horseshoe,Pen y Fan Horseshoe,brecon-beacons,51.8839,-3.4367,12.0,750,circular,5-6,mountain-path,challenging,,OL12,,51.8973,-3.4182,free,none,Yes,no,spring-autumn,weather|steep-drops,ridge-walk|views|quieter,85,Classic,"The classic horseshoe route from Cwm Gwdi. Ascends Cribyn, Pen y Fan, Corn Du. Much quieter and more scenic than the main tourist tracks.",experienced-hikers,circular|dog-friendly,clear-weather-only|exposed,ridge-walking|solitude|views
corn-du-pen-y-fan,Corn Du & Pen y Fan Circular,brecon-beacons,51.8814,-3.4406,7.0,500,circular,3-4,mountain-path,moderate,,OL12,,51.8672,-3.4564,free,toilets|food-truck,Yes,yes,year-round,weather|steep-sections,two-summits|views|lake-views,85,Classic,Circular loop taking in both main peaks. Go up Corn Du first for dramatic reveal of Pen y Fan. Descent via main path.,families,circular|dog-friendly|toilets|waymarked,clear-weather-only,lakes|views
fan-y-big-gap,Fan y Big via The Gap,brecon-beacons,51.8756,-3.4123,10.0,550,circular,4-5,mountain-path,moderate-challenging,,OL12,,51.8532,-3.3798,free,none,Yes,partial,spring-autumn,weather|remote,diving-board|views|roman-road,85,Classic,Route to the famous 'Diving Board' rock. Uses the Roman Road (The Gap). Less crowded. Great views of the main peaks.,,circular|dog-friendly,clear-weather-only,views
fan-brycheiniog-llyn-y-fan-fach,Fan Brycheiniog & Llyn y Fan Fach,brecon-beacons,51.8839,-3.7114,8.0,600,circular,3-4,mountain-path,moderate,,OL12,,51.8967,-3.7508,free,none,Yes,no,spring-autumn,cliffs|weather,lake|legend|cliffs,85,Classic,Spectacular walk in the Black Mountain range (western Brecons). Visit the legendary 'Lady of the Lake'. Dramatic escarpment walking.,families,circular|dog-friendly,clear-weather-only,coastal|lakes
carmarthen-fans,The Carmarthen Fans (Picws Du),brecon-beacons,51.8817,-3.7258,15.0,800,circular,5-6,mountain-path,challenging,,OL12,,51.8967,-3.7508,free,none,Yes,no,spring-autumn,weather|navigation|remote,ridge-walk|wild|lakes,85,Classic,"Extended loop taking in Fan Brycheiniog, Picws Du and Fan Foel. One of the finest ridge walks in Wales. Wild and remote feel.",experienced-hikers,circular|dog-friendly,clear-weather-only|navigation-skills,lakes|ridge-walking|solitude
four-falls-trail,Four Falls Trail,brecon-beacons,51.8012,-3.5501,9.0,250,circular,3-4,woodland-path,moderate,,OL12,,51.8012,-3.5501,paid,toilets|shop,Yes,yes,year-round,slippery-rocks|mud,waterfalls|caves|woodland,85,Classic,"Famous waterfall walk visiting Sgwd Clun-Gwyn, Sgwd Isaf Clun-Gwyn, Sgwd y Pannwr, and Sgwd yr Eira (where you can walk behind the falls).",families,circular|dog-friendly|toilets|waymarked,,waterfalls
elidir-trail,Elidir Trail (Waterfall Country),brecon-beacons,51.7583,-3.5902,6.0,150,out-and-back,2-3,river-path,easy-moderate,,OL12,,51.7583,-3.5902,free,cafe|toilets,Yes,yes,year-round,slippery-paths,waterfalls|fairy-glen|accessible-start,85,Classic,Scenic riverside walk from Pontneddfechan. Passes multiple waterfalls including Sgwd Gwladus. Mythical 'Fairy Glen' atmosphere.,families,cafe|dog-friendly|linear|toilets|waymarked,,waterfalls
sugar-loaf,Sugar Loaf,brecon-beacons,51.8582,-3.0581,6.0,350,circular,2.5,moorland,moderate,,OL13,,51.8504,-3.0423,free,none,Yes,partial,year-round,weather,views|accessible|heather,85,Classic,Iconic conical peak near Abergavenny. Gentle ascent with massive views. Great for families and sunset walks.,families,circular|dog-friendly,clear-weather-only,views
skirrid-fawr,The Skirrid (Skirrid Fawr),brecon-beacons,51.8483,-2.9753,6.0,300,circular,2-3,hill-path,moderate,,OL13,,51.8389,-2.9806,paid,none,Yes,yes,year-round,steep-start|mud,views|history|landslide,85,Classic,The 'Holy Mountain'. Steep initial climb through woods then open ridge. Famous for its landslide scar and ruined chapel on summit.,families,circular|dog-friendly|waymarked,,history|ridge-walking|views
blorenge,The Blorenge,brecon-beacons,51.7917,-3.0417,11.0,450,circular,3-4,moorland,moderate,,OL13,,51.7917,-3.0764,free,none,Yes,partial,year-round,weather|boggy,views|industrial-history|lake,85,Classic,"Diverse walk overlooking Abergavenny. Takes in the Keeper's Pond, industrial heritage, and open moorland. Great views of Sugar Loaf.",families,circular|dog-friendly,boggy|clear-weather-only,history|lakes|views
table-mountain-crickhowell,Table Mountain (Crug Hywel),brecon-beacons,51.8767,-3.1367,7.0,380,circular,3,hill-path,moderate,,OL13,,51.8600,-3.1383,paid,cafe|toilets,Yes,yes,year-round,steep-sections,views|iron-age-fort|town-start,85,Classic,Start from Crickhowell village. Climb to the flat-topped summit with Iron Age hillfort. Stunning views over Usk Valley.,families,cafe|circular|dog-friendly|toilets|waymarked,,views
hay-bluff,Hay Bluff,brecon-beacons,52.0289,-3.1114,5.0,250,circular,2-3,hill-path,moderate,,OL13,,52.0225,-3.1092,free,none,Yes,no,year-round,weather|wind,views|border-walk|open-ridge,85,Classic,Prominent bluff overlooking Hay-on-Wye. Steep start then flat ridge. Often combined with Twmpa.,families,circular|dog-friendly,clear-weather-only,ridge-walking|views
lord-herefords-knob,Twmpa (Lord Hereford's Knob),brecon-beacons,52.0125,-3.1208,6.0,250,circular,2.5,hill-path,moderate,,OL13,,52.0225,-3.1092,free,none,Yes,no,year-round,weather,views|ridge-walk,85,Classic,Opposite Hay Bluff across Gospel Pass. Great views into the secluded valleys. Can be done with Hay Bluff for a longer day.,families,circular|dog-friendly,clear-weather-only,ridge-walking|views
waun-fach-dragons-back,Waun Fach & The Dragon's Back,brecon-beacons,51.9644,-3.1583,12.0,700,circular,5,mountain-path,challenging,,OL13,,51.9619,-3.1883,paid,pub,Yes,partial,spring-autumn,boggy|weather,ridge-walk|highest-peak|views,85,Classic,Highest peak in the Black Mountains. Ascend via the undulating 'Dragon's Back' ridge from Pengenffordd. Classic route.,experienced-hikers,circular|dog-friendly|pub,boggy|clear-weather-only,ridge-walking|views
craig-cerrig-gleisiad,Craig Cerrig Gleisiad,brecon-beacons,51.8667,-3.4833,5.0,300,circular,2,mountain-path,moderate,,OL12,,51.8667,-3.4833,free,none,Yes,partial,spring-autumn,steep-sections,wildlife|glacial-cwm|quiet,85,Classic,Nature reserve with dramatic glacial cwm. Great alternative to Pen y Fan. Rich in wildflowers and birdlife (Ring Ouzel).,families,circular|dog-friendly,,solitude
henrhyd-falls,Henrhyd Falls & Nant Llech,brecon-beacons,51.7967,-3.6639,5.0,200,out-and-back,2,woodland-path,easy-moderate,,OL12,,51.7967,-3.6639,free,none,Yes,yes,year-round,slippery-rocks|mud,tallest-waterfall|batman-cave,85,Classic,Visit South Wales' highest waterfall (Batcave location). Walk down the Nant Llech valley for a peaceful woodland stroll.,families,dog-friendly|linear|waymarked,,waterfalls
llyn-y-fan-fawr,Llyn y Fan Fawr,brecon-beacons,51.8667,-3.6833,10.0,550,circular,4,mountain-path,moderate,,OL12,,51.8417,-3.6583,free,none,Yes,no,spring-autumn,weather|boggy,lake|remote|wild-swimming,85,Classic,"The larger, wilder lake. Start from Tafarn-y-Garreg. Steep climb up to the escarpment. Very remote feel.",families,circular|dog-friendly,boggy|clear-weather-only,lakes|solitude
tor-y-foel,Tor y Foel,brecon-beacons,51.8667,-3.2833,8.0,350,circular,3,hill-path,moderate,,OL13,,51.8500,-3.2833,free,cafe,Yes,partial,year-round,mud,reservoir-views|canal,85,Classic,"Overlooks Talybont Reservoir. Mix of canal towpath, woodland, and open hill. Panoramic views from summit.",families,cafe|circular|dog-friendly,,views
ysgyryd-fach,Ysgyryd Fach (Little Skirrid),brecon-beacons,51.8250,-2.9917,5.0,200,circular,2,woodland-path,easy,,OL13,,51.8250,-2.9917,free,none,Yes,partial,year-round,mud,views|quiet|woods,85,Classic,The smaller neighbour to the Skirrid. Gentle walk with nice views over Abergavenny. Good for a quick stretch.,families,circular|dog-friendly,,solitude|views
fan-gyhirych,Fan Gyhirych,brecon-beacons,51.8583,-3.6333,10.0,500,circular,4,mountain-path,moderate,,OL12,,51.8333,-3.6333,free,none,Yes,no,spring-autumn,navigation,views|quiet|geology,85,Classic,Lesser known peak in Fforest Fawr. Great views of the Fans. Interesting geology and sinkholes.,families,circular|dog-friendly,navigation-skills,solitude|views
pen-y-crug,Pen y Crug,brecon-beacons,51.9583,-3.4000,5.0,200,circular,1.5,hill-path,easy,,OL12,,51.9500,-3.4000,free,none,Yes,yes,year-round,livestock,views|hillfort|easy-access,85,Classic,Short walk from Brecon town. Iron Age hillfort with commanding views of the central Beacons.,families,circular|dog-friendly|waymarked,,views
talybont-reservoir,Talybont Reservoir Walk,brecon-beacons,51.8833,-3.2833,9.0,100,linear,2.5,forest-track,easy,,OL12,,51.8500,-3.2833,free,toilets,Yes,yes,year-round,logging-trucks,reservoir|flat|birdwatching,85,Classic,Flat walk along the old railway line/forestry track beside the reservoir. Great for families and buggies.,families,accessible|dog-friendly|linear|toilets|waymarked,,
llanthony-priory,Llanthony Priory Circular,brecon-beacons,51.9417,-3.0333,8.0,400,circular,3,hill-path,moderate,,OL13,,51.9417,-3.0333,free,pub|toilets,Yes,partial,spring-autumn,steep-climb,ruins|history|views,85,Classic,Start at the stunning priory ruins. Climb the valley sides for views of the Black Mountains. Finish with a drink in the cellar bar.,families,circular|dog-friendly|pub|toilets,,history|views
