slug,name,description,use_for
guide,Activity & Location Guides,"Deep dives into specific activities or Welsh locations. What it is, who it's for, where to go, difficulty, best conditions.","Activity explainers (coasteering, hiking, MTB), location guides (48 Hours in Snowdonia, Pembrokeshire Beyond Beaches)"
gear,Gear Guides,"What to bring, what to skip, budget vs premium options. Practical packing lists.","Wetsuit guides, waterproof jacket reviews, packing lists, budget gear, kids gear, photography gear"
safety,Safety Guides,"Honest safety information. What can go wrong, how to prepare, when to bail.","Mountain safety, water safety, weather awareness, group management, solo safety, emergency contacts"
seasonal,Seasonal Content,"What's on and what's best at different times of year. Honest about Welsh weather.","What's open in winter, school holiday planners, bank holiday ideas, festival season, dark skies"
news,News & Updates,"Platform news, new operators, route changes, event announcements.","New operators joining, route closures, event announcements, site updates"
trip-report,Trip Reports,"First-person accounts of actual trips. Honest about what went right and wrong.","We tried Snowdonia Weekend, Family in Pembrokeshire, Solo in North Wales, Budget challenge, Rainy week"
spotlight,Operator Spotlights,"Profiles of adventure operators. Their story, what makes them different, what they offer.","TYF Adventure profile, Zip World profile, small operator features, how to choose an operator"
